{
  "document_type": "changelog",
  "locale": "zh-CN",
  "meta": {
    "title": "Momo Platform v3.2.0",
    "subtitle": "AI 助手集成、实时协作、性能大幅提升",
    "eyebrow": "Momo Paper / changelog / zh-CN",
    "date": "2025-04-28",
    "version": "v3.2.0"
  },
  "sections": {
    "highlights": {
      "items": [
        "全新 AI 写作助手，支持智能续写、润色与翻译",
        "实时协作功能：多人同时编辑，支持光标跟踪与评论",
        "首屏加载速度提升 45%，大文档操作更加流畅"
      ]
    },
    "changes": [
      {
        "category": "added",
        "items": [
          "AI 写作助手模块（Beta）",
          "实时协作编辑功能",
          "深色模式支持",
          "导出为 PPTX 格式"
        ]
      },
      {
        "category": "changed",
        "items": [
          "编辑器内核升级至 ProseMirror 2.0",
          "文件存储迁移至对象存储，降低 30% 成本",
          "搜索索引策略优化，搜索结果相关性提升"
        ]
      },
      {
        "category": "fixed",
        "items": [
          "修复大文件（>50MB）上传超时问题",
          "修复表格在移动端显示异常的问题",
          "修复协作时偶发的内容冲突问题"
        ]
      },
      {
        "category": "deprecated",
        "items": [
          "旧版 API v1 将于 2025-06-30 停用，请迁移至 v2"
        ]
      }
    ],
    "migration": {
      "body": [
        "API v1 用户需在 2025-06-30 前完成迁移。v2 API 文档已更新，主要变更包括：认证方式改为 OAuth 2.0，请求体格式统一为 JSON。",
        "团队协作功能需要管理员在后台开启「实时协作」开关。开启后，所有团队成员自动获得协作编辑权限。"
      ]
    }
  }
}
